{
  "manifest_schema_version": 1,
  "generated_at": "2026-10-18",
  "generator": "scripts/check_decomposition_reconciliation.py",
  "parent_cr": "CR-BP-94-EXT-05",
  "catalog_root": "/home/hermes/dea-catalog-processes",
  "summary": {
    "total_records": 3728,
    "by_rule": {
      "DOC-021": 0,
      "DOC-022": 0,
      "DOC-023": 0,
      "DOC-024": 0,
      "DOC-025": 0
    },
    "total_findings": 0,
    "advisory_findings": 0
  },
  "findings": []
}